{
  "artifacts": [],
  "board_id": null,
  "command": "arc1 device flash --partition F1MA --image plan-image-fw.bin",
  "details": {
    "plan": {
      "commands": [
        "xfel version                         # must report chip ID 0x00185900",
        "xfel spinor                          # must report the 64 MiB system NOR",
        "xfel spinor read 0x00300000 8388608 before.bin   # back up the slot first",
        "xfel spinor write 0x00300000 plan-image-fw.bin",
        "xfel spinor read 0x00300000 4096 readback.bin",
        "sha256sum plan-image-fw.bin readback.bin           # both must equal f600eca824e84a43f0691b267bd620e462c50da165c5b80e17aecb7a924f1fa8"
      ],
      "fill_percent": 0.0,
      "fits": true,
      "gates": [
        {
          "gate": "board_identity",
          "reason": "No identified ARC-1 board: R10 is on fabrication HOLD.",
          "state": "OPEN"
        },
        {
          "gate": "recovery_verified",
          "reason": "FEL fall-through recovery on rear USB-C is not bench-proven (R10 change order CO-4).",
          "state": "OPEN"
        },
        {
          "gate": "owner_approval",
          "reason": "No recorded owner approval for a board-affecting operation (spec SEC-004).",
          "state": "OPEN"
        }
      ],
      "image": {
        "bytes": 4096,
        "path": "passes/ARC1-PASS-0004/reports/plan-image-fw.bin",
        "sha256": "f600eca824e84a43f0691b267bd620e462c50da165c5b80e17aecb7a924f1fa8"
      },
      "operation": "write plan-image-fw.bin (4096 bytes) to NOR partition F1MA 'F133 firmware A' at 0x00300000",
      "partition": {
        "boot_rom_reads": false,
        "contents": "main F133 firmware",
        "id": "F1MA",
        "name": "F133 firmware A",
        "offset": 3145728,
        "protection": "unlocked",
        "size": 8388608,
        "status": "PROPOSED (ARC1_MEMORY_R10 v0.1 s4 map, unchanged)",
        "written_by": "updater (inactive slot only)"
      },
      "risks": [
        "A failed write to a boot-path partition can leave the console unable to boot until FEL recovery works.",
        "The xfel SPI NOR sequence was written for R08 (32 MiB NOR) and is unverified on the R10 64 MiB NOR."
      ],
      "rollback": "Not ready: rollback relies on FEL fall-through, which is bench-OPEN (CO-4).",
      "transport": "F133 FEL over rear USB-C (xfel); command sequence UNVERIFIED on R10",
      "write_enabled": false
    }
  },
  "evidence_level": "NONE",
  "failure_reasons": [
    {
      "code": "SEC-004",
      "message": "write disabled. No identified ARC-1 board: R10 is on fabrication HOLD. FEL fall-through recovery on rear USB-C is not bench-proven (R10 change order CO-4). No recorded owner approval for a board-affecting operation (spec SEC-004)."
    }
  ],
  "input_digest": "a3dc7c8d9c2cf78c180a1a88db0b7f8513d57326e9935ef2f4c0059e9c84de0f",
  "invocation_id": "36c58deb1e87e5b1c16e8e8bb7046ae2",
  "schema_version": "arc1.tool-result/0.2",
  "sdk_version": "0.2.0-dev",
  "toolchain_digest": "b9017f98bc1a948abb6ae8987e74c87f621fa7c22e8849914bc565a03b2c1141",
  "verdict": "NOT_AVAILABLE",
  "warnings": [
    "Plan only: nothing was written and no device was contacted"
  ]
}
