{
  "artifacts": [],
  "board_id": null,
  "command": "arc1 device detect",
  "details": {
    "fel_device": null,
    "xfel": null
  },
  "evidence_level": "NONE",
  "failure_reasons": [
    {
      "code": "CLI-002",
      "message": "xfel is not installed; it is the PC-side FEL tool for the rear USB-C port"
    }
  ],
  "input_digest": "a05651a8403298a51133c791789c19c543f16bf2688d571887c2e2cd710d5fcd",
  "invocation_id": "0a9d23cc3866e78e8890a03c33dccc91",
  "schema_version": "arc1.tool-result/0.2",
  "sdk_version": "0.2.0-dev",
  "toolchain_digest": "b9017f98bc1a948abb6ae8987e74c87f621fa7c22e8849914bc565a03b2c1141",
  "verdict": "NOT_AVAILABLE",
  "warnings": []
}
